<?xml version="1.0" encoding="UTF-8"?>
<dayservice xmlns:xsi="http://www.w3.org/2001/XMLSchema-instance" xsi:noNamespaceSchemaLocation="../../DaySchema.xsd">
	<esperinos>
		<prokeimeni>
			<prokeimenon ihos="5">
				<stihos>
					<item language="cs-cs">Б9е, во и4мz твоE спаси1 мz, / и3 въ си1лэ твоeй суди1 ми.</item>
					<item language="cs-ru">Бо́же, во и́мя Твое́ спаси́ мя, / и в си́ле Твое́й суди́ ми.</item>
				</stihos>
				<stihos>
					<item language="cs-cs">Б9е, ўслhши моли1тву мою2, внуши2 глаг0лы ќстъ мои1хъ.</item>
					<item language="cs-ru">Бо́же, услы́ши моли́тву мою́, внуши́ глаго́лы уст мои́х.</item>
				</stihos>
			</prokeimenon>
		</prokeimeni>
	</esperinos>
	<orthros>
		<kanones>
			<kanonas>
				<kontakion ihos="2">
					<ymnos>
						<item language="cs-cs">Твє1рдыz и3 бGовэщ†нныz проповёдатели, вeрхъ ў§нкъ твои1хъ
гDи, пріsлъ є3си2 въ наслаждeніе бlги1хъ твои1хъ и3 пок0й: болBзни
бо џнэхъ, и3 смeрть пріsлъ є3си2 пaче всsкагw всепл0діz, є3ди1не
свёдый сердє1чнаz.</item>
						<item language="cs-ru">Твердыя и боговещанныя проповедатели, / верх апостолов Твоих, Господи, / приял еси в наслаждение благих Твоих и покой: / болезни бо онех и смерть приял еси паче всякаго всеплодия, / Едине, сведый сердечная.</item>
					</ymnos>
				</kontakion>
				<exapostilarion>
					<ymnos>
						<prosomoion>
							<item language="cs-cs">Жєны2 ўслhшите</item>
						</prosomoion>
						<text>
							<item language="cs-cs">Во всю2 подс0лнечную тeкше проповёдасте хrт0во t дв7ы с™0е воплощeніе вои1стинну, t прeлести њбращaюще kзhки, и3 просвэщaюще, и3 вс‰ научaюще трbцу почитaти с™yю, ґпcли сп7сwвы.</item>
						</text>
					</ymnos>
					<theotokion>
						<text>
							<item language="cs-cs">МRjе чистёйшаz, златaz кади1льнице, невмэсти1магw б9ествA пріsтелище бhвшее, въ нeмже nц7ъ бlговоли2, сн7ъ же всели1сz, и3 д¦ъ с™hй њсэни1въ тS nтрокови1це показA бцdу.</item>
						</text>
					</theotokion>
				</exapostilarion>
			</kanonas>
			<kanonas>
				<kontakion ihos="3">
					<ymnos>
						<item language="cs-ru">В Мирех, святе, священнодействитель показался еси, / Христово бо, преподобне, Евангелие исполнив, / положил еси душу твою о людех твоих / и спасл еси неповинныя от смерти. / Сего ради освятился еси, / яко великий таинник Божия благодати.</item>
						<item language="cs-cs">Въ мЂрэхъ, сTMе, сщ7еннодёйствитель показaлсz є3си2, хrт0во бо,
прпdбне, є3ђліе и3сп0лнивъ: положи1лъ є3си2 дyшу твою2 њ лю1дехъ
твои1хъ, и3 сп7слъ є3си2 непови6нныz t смeрти. Сегw2 рaди њсTMи1лсz
є3си2, ћкw вели1кій таи1нникъ б9іz бlгодaти.</item>
					</ymnos>
				</kontakion>
				<exapostilarion>
					<ymnos>
						<prosomoion>
							<item language="cs-cs">Жєны2 ўслhшите</item>
						</prosomoion>
						<text>
							<item language="cs-cs">Вели1каго началопaстырz, и3 їерaрха вси2, предсэдaтелz мmрлmкjйскаго ніколaа хвaлимъ: мнHги бо мyжи сп7сE, непрaведнw ўмрeти и3мyщыz, царю2 kвлsетсz со ґvлaвіемъ во снЁ, рэшS непрaведное и3зречeніе.</item>
						</text>
					</ymnos>
				</exapostilarion>
			</kanonas>
		</kanones>
	</orthros>
	<leitourgia>
		<prokeimenon ihos="8">
			<stihos>
				<item language="cs-cs">Во всю2 зeмлю и3зhде вэщaніе и4хъ, / и3 въ концы2 вселeнныz глаг0лы и4хъ.</item>
				<item language="cs-ru">Во всю землю изыде вещание их / и в концы вселенныя глаголы их.</item>
			</stihos>
			<stihos>
				<item language="cs-cs">Нб7сA повёдаютъ слaву б9ію, творeніе же рукY є3гw2 возвэщaетъ твeрдь.</item>
				<item language="cs-ru">Небеса поведают славу Божию, / творение же руку Его возвещает твердь.</item>
			</stihos>
		</prokeimenon>
		<alleluia ihos="1">
			<stihos>
				<item language="cs-cs">И#сповёдzтъ небесA чудесA тво‰ гDи, и4бо и4стину твою2 въ цRкви с™hхъ.</item>
				<item language="cs-ru">Исповедят небеса чудеса Твоя, Господи, ибо истину Твою в Церкви святых.</item>
			</stihos>
			<stihos>
				<item language="cs-cs">БGъ прославлsемь въ совётэ с™hхъ.</item>
				<item language="cs-ru">Бог прославляем в совете святых.</item>
			</stihos>
		</alleluia>
		<kinonik>
			<item language="cs-cs">Во всю2 зeмлю и3зhде вэщaніе и4хъ и3 въ концы2 вселeнныz глаг0лы и4хъ.</item>
			<item language="cs-ru">Во всю землю изыде вещание их, и в концы вселенныя глаголы их.</item>
		</kinonik>
	</leitourgia>
</dayservice>
